{
  "schema_version": "1.0",
  "domain_profile": "software-hardware",
  "state": "AWAITING_APPROVAL",
  "project": {
    "name": "Representative Hardware Project",
    "objective": "Deliver a verified hardware-connected software capability.",
    "definition_of_done": [
      "Approved architecture is decomposed into independently verifiable work."
    ],
    "non_goals": [
      "Unapproved hardware redesign"
    ],
    "constraints": [
      "Physical hardware claims require representative evidence"
    ]
  },
  "architecture": {
    "summary": "Separate protocol, transport, device abstraction, application logic and validation boundaries.",
    "boundaries": [
      "Workers may not change public interfaces without architecture approval"
    ],
    "milestones": [
      "Baseline",
      "Implementation",
      "Integration verification"
    ],
    "dependencies": [
      "Baseline -> Implementation",
      "Implementation -> Integration verification"
    ]
  },
  "sources": [
    "Repository",
    "Authoritative hardware/protocol documentation"
  ],
  "risks": [
    "Simulation may diverge from physical hardware"
  ],
  "routing": {
    "policy": "Assign the cheapest capability tier expected to satisfy objective acceptance criteria."
  },
  "human_gates": [
    "Material architecture change",
    "Consequential external action"
  ],
  "domain": {
    "baseline": "Fictional serial test adapter repository at its synthetic known-good tag; no physical device. Source: synthetic fixture specification.",
    "hardware_identity": "Fictional SYNTH-SENSOR-1 board revision A, firmware 0.0.0-synthetic; establishes no real hardware behavior.",
    "interfaces": "Line-based loopback interface, SYNTH-FRAME-1 synthetic wire format, version 1.",
    "specifications": "The synthetic fixture specification embedded in examples/software-hardware; no manufacturer document exists.",
    "environment": "Python 3.12 host tests only; no deployment target.",
    "known_paths": "Known-good: fake device round trip in the sample tests. Known-failing: none observed, because no hardware has been observed.",
    "validation_resources": "Local fake device and loopback transport only; physical hardware claims remain unverified.",
    "physical_access": "No physical unit exists; hardware-in-loop checks in the sample can only be attested by an operator who has one.",
    "architecture_boundaries": "Frame format, transport contract and the device abstraction boundary require user approval to change."
  },
  "approval": {
    "approved": false,
    "approved_by": null,
    "approved_at": null,
    "architecture_fingerprint": null
  },
  "workflow": {
    "policy": "One bounded issue per task; link validation and independent review in a PR; accept only inside the approved foundation."
  },
  "unresolved": [],
  "configuration": {},
  "documents": {}
}
